{
  "$schema": "../../schemas/evidence-register.schema.json",
  "version": "1.0.0",
  "last_reviewed_at": "2026-09-24",
  "policy": "Only claims with status=verified_fact, public_claim_approved=true, non-empty source_refs, verified_by, verified_at, and an unexpired valid_until may be published.",
  "claims": [
    {
      "claim_id": "NK-EVD-0001",
      "topic": "legal_company_identity",
      "claim": "Jinjiang Naike Gifts Co., Ltd. is the legal manufacturer represented by this repository.",
      "status": "pending_supplement",
      "public_claim_approved": false,
      "source_refs": [],
      "required_evidence": ["Current business licence", "Authorized English company-name confirmation"],
      "verified_by": null,
      "verified_at": null,
      "valid_until": null,
      "owner": "management"
    },
    {
      "claim_id": "NK-EVD-0002",
      "topic": "factory_area_and_capacity",
      "claim": "Factory area, equipment count, daily output, process tolerance, and production-capacity claims.",
      "status": "pending_supplement",
      "public_claim_approved": false,
      "source_refs": [],
      "required_evidence": ["Signed facility profile", "Equipment ledger", "Recent production records"],
      "verified_by": null,
      "verified_at": null,
      "valid_until": null,
      "owner": "operations_quality"
    },
    {
      "claim_id": "NK-EVD-0003",
      "topic": "disney_fama",
      "claim": "Disney FAMA status, facility code, scope, and validity claims.",
      "status": "pending_supplement",
      "public_claim_approved": false,
      "source_refs": [],
      "required_evidence": ["Current FAMA letter", "Scope and expiry confirmation", "Written permission for public display"],
      "verified_by": null,
      "verified_at": null,
      "valid_until": null,
      "owner": "operations_quality"
    },
    {
      "claim_id": "NK-EVD-0004",
      "topic": "coca_cola_sgp",
      "claim": "Coca-Cola SGP audit, rating, findings, and public-use claims.",
      "status": "pending_supplement",
      "public_claim_approved": false,
      "source_refs": [],
      "required_evidence": ["Current audit report", "Rating and scope confirmation", "Written permission for public display"],
      "verified_by": null,
      "verified_at": null,
      "valid_until": null,
      "owner": "operations_quality"
    },
    {
      "claim_id": "NK-EVD-0005",
      "topic": "sedex_smeta",
      "claim": "Sedex SMETA audit type, status, scope, and validity claims.",
      "status": "pending_supplement",
      "public_claim_approved": false,
      "source_refs": [],
      "required_evidence": ["Current SMETA report", "Audit date and scope", "Public disclosure approval"],
      "verified_by": null,
      "verified_at": null,
      "valid_until": null,
      "owner": "operations_quality"
    },
    {
      "claim_id": "NK-EVD-0006",
      "topic": "solar_and_esg",
      "claim": "Solar capacity, annual generation, electricity offset, carbon reduction, and Scope 1/2 claims.",
      "status": "pending_supplement",
      "public_claim_approved": false,
      "source_refs": [],
      "required_evidence": ["Grid-connection or installation record", "Metered generation report", "Documented carbon-calculation method"],
      "verified_by": null,
      "verified_at": null,
      "valid_until": null,
      "owner": "operations_quality"
    },
    {
      "claim_id": "NK-EVD-0007",
      "topic": "product_compliance",
      "claim": "FDA, LFGB, EU, CPSIA, REACH, EN, ASTM, FSC, GRS, PFAS, BPA, migration-test, and related compliance claims for each SKU.",
      "status": "pending_supplement",
      "public_claim_approved": false,
      "source_refs": [],
      "required_evidence": ["SKU-material-market test report", "Report number and laboratory", "Sample identity and valid date"],
      "verified_by": null,
      "verified_at": null,
      "valid_until": null,
      "owner": "operations_quality"
    },
    {
      "claim_id": "NK-EVD-0008",
      "topic": "product_performance",
      "claim": "Leakproof, drop, dishwasher, temperature, thermal, tensile, sealing, opening-cycle, load, and other performance claims.",
      "status": "pending_supplement",
      "public_claim_approved": false,
      "source_refs": [],
      "required_evidence": ["Test method", "Dated test record", "Tested SKU and material batch"],
      "verified_by": null,
      "verified_at": null,
      "valid_until": null,
      "owner": "operations_quality"
    },
    {
      "claim_id": "NK-EVD-0009",
      "topic": "commercial_terms",
      "claim": "MOQ, FOB price, sample time, lead time, payment, tooling refund, port, packaging, and container-load claims.",
      "status": "pending_supplement",
      "public_claim_approved": false,
      "source_refs": [],
      "required_evidence": ["Approved current price sheet", "Signed commercial policy", "SKU packaging and loading calculation"],
      "verified_by": null,
      "verified_at": null,
      "valid_until": null,
      "owner": "sales_director"
    },
    {
      "claim_id": "NK-EVD-0010",
      "topic": "customer_and_market_proof",
      "claim": "Customer relationships, authorization, rankings, case studies, sales results, and market-performance claims.",
      "status": "pending_supplement",
      "public_claim_approved": false,
      "source_refs": [],
      "required_evidence": ["Customer-approved case material", "Authorization or contract excerpt", "Dated performance source"],
      "verified_by": null,
      "verified_at": null,
      "valid_until": null,
      "owner": "management"
    }
  ]
}
